{
  "verified_items": [
    {"描述": "set设置TTL后get在TTL内返回正确值", "验证方式": "time.sleep验证"},
    {"描述": "TTL过期后get返回None", "验证方式": "time.sleep等待过期"},
    {"描述": "同key重新set更新TTL", "验证方式": "先设短TTL再设长TTL，get验证"},
    {"描述": "超过max_size插入新key时淘汰最久未使用项", "验证方式": "set max_size=3，插入4个key，验证第1个被淘汰"},
    {"描述": "get访问过的key不算最久未使用", "验证方式": "max_size=2，插入a,b后get(a)，再insert c，验证b被淘汰"},
    {"描述": "100线程并发读写不崩溃", "验证方式": "运行并发压力测试脚本"},
    {"描述": "delete后get返回None", "验证方式": "set后delete再get"},
    {"描述": "clear后size=0", "验证方式": "clear后调用size()"}
  ],
  "must_fix": [
    {"描述": "get中过期判断必须在move_to_end之前，否则过期key污染LRU", "严重程度": "critical"},
    {"描述": "set已存在key时LRU顺序必须正确更新，不能误淘汰已存在key", "严重程度": "critical"},
    {"描述": "并发淘汰可能导致瞬时超max_size", "严重程度": "major"},
    {"描述": "并发下clear后需确保已持有锁的线程不会拿到悬空引用", "严重程度": "major"},
    {"描述": "已过期键需有主动清理或惰性清理保证不OOM", "严重程度": "major"},
    {"描述": "使用time.monotonic()替代time.time()防止时钟跳变", "严重程度": "minor"}
  ],
  "suggested_optimizations": [
    {"描述": "增加keys()方法用于诊断缓存状态"}
  ],
  "rejected_challenges": [
    {"挑战": "TTL精度应为毫秒级", "驳回理由": "任务明确要求秒级精度"},
    {"挑战": "需要LFU和FIFO等多种淘汰策略", "驳回理由": "超出当前需求范围"},
    {"挑战": "需要读写锁优化读多写少场景", "驳回理由": "L1保持简洁"},
    {"挑战": "需要返回是否命中缓存的布尔值", "驳回理由": "当前需求未提及"}
  ],
  "rounds_completed": 1,
  "converged": true,
  "dimensions_covered": [
    {"name": "TTL过期机制", "status": "covered", "must_fix_count": 2, "attack_count": 3},
    {"name": "LRU淘汰策略", "status": "covered", "must_fix_count": 2, "attack_count": 3},
    {"name": "并发安全", "status": "covered", "must_fix_count": 2, "attack_count": 3},
    {"name": "API完整性", "status": "covered", "must_fix_count": 1, "attack_count": 3}
  ],
  "dimension_count": 4,
  "attacks": [
    {"描述": "已过期键永久占用内存，缺少主动清理", "target_dimension": "TTL过期机制", "score": 4, "scoring_rationale": "OOM风险"},
    {"描述": "set同key新TTL覆盖逻辑", "target_dimension": "TTL过期机制", "score": 3, "scoring_rationale": "核心逻辑正确性"},
    {"描述": "time.time()非单调导致TTL跳变", "target_dimension": "TTL过期机制", "score": 3, "scoring_rationale": "生产环境风险"},
    {"描述": "set已存在key时LRU顺序可能错误导致误淘汰", "target_dimension": "LRU淘汰策略", "score": 4, "scoring_rationale": "淘汰判断依赖LRU顺序"},
    {"描述": "max_size=0语义未定义", "target_dimension": "LRU淘汰策略", "score": 3, "scoring_rationale": "边界定义模糊"},
    {"描述": "并发淘汰同时淘汰不同key导致超max_size", "target_dimension": "LRU淘汰策略", "score": 5, "scoring_rationale": "破坏容量核心保证"},
    {"描述": "get中检查key存在和move_to_end之间有TOCTOU竞态", "target_dimension": "并发安全", "score": 4, "scoring_rationale": "竞态条件"},
    {"描述": "锁覆盖范围不足", "target_dimension": "并发安全", "score": 3, "scoring_rationale": "需审查锁完整性"},
    {"描述": "clear后旧引用导致脏读或异常", "target_dimension": "并发安全", "score": 5, "scoring_rationale": "未定义行为"},
    {"描述": "过期key在get中被move_to_end污染LRU", "target_dimension": "API完整性", "score": 4, "scoring_rationale": "过期key当热key"},
    {"描述": "delete不存在的key语义模糊", "target_dimension": "API完整性", "score": 2, "scoring_rationale": "API契约模糊"},
    {"描述": "缺少遍历接口，运维可观测性差", "target_dimension": "API完整性", "score": 3, "scoring_rationale": "运维缺失"}
  ]
}